{
  "$schema": "https://raw.githubusercontent.com/EvanL1/AetherContracts/main/ai/docs-manifest.schema.json",
  "schema_version": 3,
  "project": "AetherContracts",
  "latest_published_release": "v0.1.0-alpha.4",
  "development_target": "0.1.0-alpha.5",
  "production_ready": false,
  "legacy_default": true,
  "release_closure_authority": "contract-manifest.json",
  "documents": [
    {
      "id": "agent-instructions",
      "path": "AGENTS.md",
      "canonical_url": "https://github.com/EvanL1/AetherContracts/blob/main/AGENTS.md",
      "title": "Agent instructions",
      "description": "Read before changing any contract, binding, fixture, compatibility claim, or release evidence.",
      "locale": "en",
      "translation_of": null,
      "document_role": "agent-task",
      "agent_profiles": [
        "coding-agent",
        "operator-agent",
        "runtime-agent"
      ],
      "intents": [
        "change-contract",
        "inspect-authority"
      ],
      "implementation_status": "implemented",
      "production_readiness": "not-applicable",
      "context_sensitivity": "public",
      "updated": "2026-07-18",
      "priority": "core"
    },
    {
      "id": "project-overview",
      "path": "README.md",
      "canonical_url": "https://github.com/EvanL1/AetherContracts/blob/main/README.md",
      "title": "Project overview and development status",
      "description": "Understand scope, authority, safety boundaries, implemented surfaces, and unresolved production gates.",
      "locale": "en",
      "translation_of": null,
      "document_role": "agent-task",
      "agent_profiles": [
        "coding-agent",
        "operator-agent",
        "runtime-agent"
      ],
      "intents": [
        "orient-repository",
        "evaluate-status"
      ],
      "implementation_status": "implemented",
      "production_readiness": "not-production-ready",
      "context_sensitivity": "public",
      "updated": "2026-07-18",
      "priority": "core"
    },
    {
      "id": "getting-started",
      "path": "docs/getting-started.md",
      "canonical_url": "https://docs.aetheriot.dev/aethercontracts/getting-started.md",
      "title": "Exact-release adoption task",
      "description": "Adopt the latest published release, select a contract surface, and run offline checks without treating the development target as published.",
      "locale": "en",
      "translation_of": null,
      "document_role": "agent-task",
      "agent_profiles": [
        "coding-agent",
        "operator-agent"
      ],
      "intents": [
        "adopt-release",
        "run-tck"
      ],
      "implementation_status": "implemented",
      "production_readiness": "experimental",
      "context_sensitivity": "public",
      "updated": "2026-07-18",
      "priority": "core"
    },
    {
      "id": "integration-task",
      "path": "docs/integration.md",
      "canonical_url": "https://docs.aetheriot.dev/aethercontracts/integration.md",
      "title": "Delegated provider integration task",
      "description": "Map provider topology and observations without moving provider credentials or arbitrary control into the public contract.",
      "locale": "en",
      "translation_of": null,
      "document_role": "agent-task",
      "agent_profiles": [
        "coding-agent",
        "operator-agent",
        "runtime-agent"
      ],
      "intents": [
        "integrate-provider",
        "map-home-assistant"
      ],
      "implementation_status": "implemented",
      "production_readiness": "experimental",
      "context_sensitivity": "public",
      "updated": "2026-07-18",
      "priority": "core"
    },
    {
      "id": "conformance-task",
      "path": "docs/conformance.md",
      "canonical_url": "https://docs.aetheriot.dev/aethercontracts/conformance.md",
      "title": "Conformance and evidence task",
      "description": "Distinguish specification, Schema, fixture, TCK, binding, and product evidence before making a conformance claim.",
      "locale": "en",
      "translation_of": null,
      "document_role": "agent-task",
      "agent_profiles": [
        "coding-agent",
        "operator-agent"
      ],
      "intents": [
        "verify-conformance",
        "classify-evidence"
      ],
      "implementation_status": "implemented",
      "production_readiness": "not-applicable",
      "context_sensitivity": "public",
      "updated": "2026-07-18",
      "priority": "core"
    },
    {
      "id": "distribution-specification",
      "path": "spec/distribution-v1alpha1.md",
      "canonical_url": "https://docs.aetheriot.dev/aethercontracts/spec/distribution-v1alpha1.md",
      "title": "Consumer distribution specification",
      "description": "Verify exact tags, manifests, artifact closures, digests, and offline or online consumer adoption.",
      "locale": "en",
      "translation_of": null,
      "document_role": "operations",
      "agent_profiles": [
        "coding-agent",
        "operator-agent"
      ],
      "intents": [
        "adopt-release",
        "verify-distribution"
      ],
      "implementation_status": "implemented",
      "production_readiness": "experimental",
      "context_sensitivity": "public",
      "updated": "2026-07-18",
      "priority": "core"
    },
    {
      "id": "consumer-lock-schema",
      "path": "schemas/distribution/v1alpha1/consumer-lock.schema.json",
      "canonical_url": "https://raw.githubusercontent.com/EvanL1/AetherContracts/main/schemas/distribution/v1alpha1/consumer-lock.schema.json",
      "title": "Consumer lock Schema",
      "description": "Validate the closed, digest-pinned release lock used by AetherEdge, AetherCloud, and independent consumers.",
      "locale": "en",
      "translation_of": null,
      "document_role": "operations",
      "agent_profiles": [
        "coding-agent",
        "operator-agent"
      ],
      "intents": [
        "create-consumer-lock",
        "verify-distribution"
      ],
      "implementation_status": "implemented",
      "production_readiness": "experimental",
      "context_sensitivity": "public",
      "updated": "2026-07-18",
      "priority": "core"
    },
    {
      "id": "consumer-lock-verifier",
      "path": "scripts/verify-consumer-lock.mjs",
      "canonical_url": "https://raw.githubusercontent.com/EvanL1/AetherContracts/main/scripts/verify-consumer-lock.mjs",
      "title": "Consumer lock verifier",
      "description": "Run the dependency-free reference verifier for release identity, artifact integrity, and adoption closure.",
      "locale": "en",
      "translation_of": null,
      "document_role": "operations",
      "agent_profiles": [
        "coding-agent",
        "operator-agent"
      ],
      "intents": [
        "verify-consumer-lock",
        "diagnose-distribution"
      ],
      "implementation_status": "implemented",
      "production_readiness": "experimental",
      "context_sensitivity": "public",
      "updated": "2026-07-18",
      "priority": "core"
    },
    {
      "id": "release-closure-manifest",
      "path": "contract-manifest.json",
      "canonical_url": "https://raw.githubusercontent.com/EvanL1/AetherContracts/main/contract-manifest.json",
      "title": "Release closure manifest",
      "description": "Use as the sole release identity, module and binding status, unresolved-gate, and artifact-hash authority; the document catalog never duplicates it.",
      "locale": "en",
      "translation_of": null,
      "document_role": "operations",
      "agent_profiles": [
        "coding-agent",
        "operator-agent"
      ],
      "intents": [
        "inspect-release-closure",
        "verify-artifact-hash"
      ],
      "implementation_status": "partial",
      "production_readiness": "not-production-ready",
      "context_sensitivity": "public",
      "updated": "2026-07-18",
      "priority": "core"
    },
    {
      "id": "mqtt-profile",
      "path": "profiles/mqtt/v1alpha1/profile.json",
      "canonical_url": "https://raw.githubusercontent.com/EvanL1/AetherContracts/main/profiles/mqtt/v1alpha1/profile.json",
      "title": "MQTT transport profile",
      "description": "Inspect bounded topics, payload limits, and transport rules without confusing Broker acknowledgement with durable application evidence.",
      "locale": "en",
      "translation_of": null,
      "document_role": "operations",
      "agent_profiles": [
        "coding-agent",
        "operator-agent",
        "runtime-agent"
      ],
      "intents": [
        "configure-mqtt",
        "inspect-transport"
      ],
      "implementation_status": "implemented",
      "production_readiness": "experimental",
      "context_sensitivity": "public",
      "updated": "2026-07-18",
      "priority": "core"
    },
    {
      "id": "agent-invariants",
      "path": "ai/invariants.md",
      "canonical_url": "https://github.com/EvanL1/AetherContracts/blob/main/ai/invariants.md",
      "title": "Agent safety invariants",
      "description": "Preserve authority, authentication, replay, durable ACK, secret, physical-control, and distribution boundaries across every refactor.",
      "locale": "en",
      "translation_of": null,
      "document_role": "safety",
      "agent_profiles": [
        "coding-agent",
        "operator-agent",
        "runtime-agent"
      ],
      "intents": [
        "enforce-invariants",
        "review-safety"
      ],
      "implementation_status": "implemented",
      "production_readiness": "not-applicable",
      "context_sensitivity": "public",
      "updated": "2026-07-18",
      "priority": "core"
    },
    {
      "id": "security-policy",
      "path": "SECURITY.md",
      "canonical_url": "https://docs.aetheriot.dev/aethercontracts/security.md",
      "title": "Security policy",
      "description": "Apply fail-closed parsing, secret handling, namespace isolation, authentication, replay, and governed-control requirements.",
      "locale": "en",
      "translation_of": null,